{
  "model": "Изготовление юбки",
  "author": "Ножкин А.М.",
  "page": "A4",

  "flows": ["Ткань", "Фурнитура", "Правила изготовления", "Швея-закройщица",
            "Выкройка", "Раскройное оборудование", "Швейная машинка",
            "Швейно-вышивальная машинка", "Детали изделия", "Собранное изделие",
            "Юбка"],

  "functions": [
    {
      "name": "Изготовление юбки",
      "in": ["Ткань", "Фурнитура"],
      "control": ["Правила изготовления"],
      "mechanism": ["Швея-закройщица", "Раскройное оборудование", "Выкройка",
                    "Швейная машинка", "Швейно-вышивальная машинка"],
      "out": ["Юбка"]
    },
    {
      "name": "Раскрой материала",
      "of": "Изготовление юбки",
      "in": ["Ткань"],
      "control": ["Правила изготовления"],
      "mechanism": ["Швея-закройщица", "Раскройное оборудование", "Выкройка"],
      "out": ["Детали изделия"],
      "note": "Ручной раскрой по лекалам"
    },
    {
      "name": "Сшивание деталей",
      "of": "Изготовление юбки",
      "in": ["Детали изделия"],
      "control": ["Правила изготовления"],
      "mechanism": ["Швея-закройщица", "Швейная машинка"],
      "out": ["Собранное изделие"]
    },
    {
      "name": "Добавление фурнитуры",
      "of": "Изготовление юбки",
      "in": ["Собранное изделие", "Фурнитура"],
      "control": ["Правила изготовления"],
      "mechanism": ["Швея-закройщица", "Швейно-вышивальная машинка"],
      "out": ["Юбка"]
    }
  ]
}
